{
  "skill": "omr-bootstrap",
  "requires": [],
  "produces": [
    {
      "artifact": "workspace structure",
      "description": "Minimal workspace files (AGENTS.md, .omr/tree-state.json); content dirs created on demand"
    },
    {
      "artifact": "AGENTS.md",
      "description": "Project instructions with skill tree state"
    }
  ],
  "gates": []
}