{
  "skill": "omr-wiki",
  "requires": [
    {
      "artifact": "any synthesis chapter OR judgment",
      "optional": false,
      "description": "Content to convert to wiki format"
    }
  ],
  "produces": [
    {
      "artifact": "wiki/*",
      "description": "Wiki pages with cross-references to synthesis"
    }
  ],
  "gates": []
}